{
  "slug": "italian-pressing",
  "term": "Italian Pressing",
  "summary": "noun / collector term. Any record manufactured in Italy — often identifiable.",
  "definition": "**noun / collector term.** Any record manufactured in Italy — often identifiable by label fonts, SIAE stamp, or unique laminated sleeves; sometimes praised for warm mastering on ’70s prog and film-score LPs.",
  "tags": [
    "pressing",
    "collecting"
  ],
  "created": "2026-01-05",
  "updated": "2026-01-05",
  "see_also": [
    "country-of-origin-pressing",
    "japanese-pressing",
    "siae-stamp"
  ],
  "regions": [
    "US"
  ]
}
