{
  "slug": "reversible-picture-sleeve-double-sided-sleeve",
  "term": "Reversible Picture-Sleeve",
  "summary": "'**noun / packaging gimmick.** A **7-inch single sleeve printed on both sides**",
  "definition": "**noun / packaging gimmick.** A **7-inch single sleeve printed on both sides** so that either side can face front, often showcasing two different cover images.",
  "tags": [
    "cultural"
  ],
  "created": "2026-01-05",
  "updated": "2026-01-05",
  "see_also": [
    "picture-sleeve",
    "gimmick-sleeve",
    "alternate-cover-art"
  ],
  "regions": [
    "US"
  ]
}
