{
  "slug": "needle-drop",
  "term": "Needle",
  "summary": "'**noun / slang.** 1 The act of lowering the stylus onto a record. 2 An informal.",
  "definition": "**noun / slang.** 1 The act of lowering the stylus onto a record. 2 An informal term for a digital recording made by playing a vinyl record (a “needle-drop transfer”). ⠀",
  "tags": [
    "equipment",
    "dj-related"
  ],
  "created": "2026-01-05",
  "updated": "2026-01-05",
  "see_also": [
    "rip-from-vinyl",
    "stylus"
  ],
  "regions": [
    "US"
  ]
}
