{
  "slug": "vacuum-platter-vacuum-hold-down",
  "term": "Vacuum Platter",
  "summary": "'**noun / turntable design.** A **turntable platter that uses gentle suction.",
  "definition": "**noun / turntable design.** A **turntable platter that uses gentle suction to flatten records against its surface** for improved coupling and reduced warps.",
  "tags": [
    "equipment"
  ],
  "created": "2026-01-05",
  "updated": "2026-01-05",
  "see_also": [
    "reflex-clamp",
    "record-weight",
    "warped-record-flattening"
  ],
  "regions": [
    "US"
  ],
  "pos": "noun"
}
