{
  "slug": "magnetic-cartridge",
  "term": "Magnetic Cartridge",
  "summary": "'**noun / technical.** A phono cartridge that uses a moving magnet (or iron).",
  "definition": "**noun / technical.** A phono cartridge that uses a moving magnet (or iron) interacting with fixed coils to generate an electrical signal â€” the dominant design since the mid-20th century.",
  "tags": [
    "equipment",
    "technical"
  ],
  "created": "2026-01-05",
  "updated": "2026-01-05",
  "see_also": [
    "moving-magnet",
    "moving-coil",
    "ceramic-cartridge"
  ],
  "regions": [
    "US"
  ],
  "pos": "noun"
}
