{
  "slug": "needle-talk-stylus-talk",
  "term": "Needle-Talk",
  "summary": "'**noun / historical slang.** The faint mechanical sound heard directly from.",
  "definition": "**noun / historical slang.** The faint mechanical sound heard directly from the stylus vibrating in the groove, audible close to the turntable even with amp volume off.",
  "tags": [
    "equipment",
    "historical"
  ],
  "created": "2026-01-05",
  "updated": "2026-01-05",
  "see_also": [
    "acoustic-phonograph",
    "groove-wall-vibration",
    "mechanical-resonance"
  ],
  "regions": [
    "US"
  ],
  "pos": "noun"
}
