{
  "slug": "wrap-around-gatefold",
  "term": "Wrap-Around Gatefold",
  "summary": "'**noun / jacket design.** A **gatefold sleeve whose artwork continues in.",
  "definition": "**noun / jacket design.** A **[gatefold](../g/gatefold.md) sleeve whose artwork continues in one continuous image across both panels and the spine**, often extending inside as well.",
  "tags": [
    "cultural"
  ],
  "created": "2026-01-05",
  "updated": "2026-01-05",
  "see_also": [
    "gatefold-sleeve",
    "tip-on-jacket",
    "die-cut-cover"
  ],
  "regions": [
    "US"
  ],
  "pos": "noun"
}
